{
  "schema": "modify_packet.v1",
  "packet_id": "session:0620_m15_qp_12:q3",
  "slot": "T-MOD",
  "created_at": "2026-09-18T19:41:27.102Z",
  "source": {
    "item_ref": "session:0620_m15_qp_12:q3",
    "item_type": "single_mcq",
    "stem": "Which statement about bonding is not correct?",
    "options": [
      {
        "id": "A",
        "text": "Carbon can form four single covalent bonds."
      },
      {
        "id": "B",
        "text": "Chlorine atoms react to gain a noble gas electronic structure."
      },
      {
        "id": "C",
        "text": "Covalent bonding involves losing and gaining electrons."
      },
      {
        "id": "D",
        "text": "Hydrogen molecules have the formula H₂."
      }
    ],
    "statements": [],
    "parts": [],
    "equations": [],
    "tables": [],
    "tikz": "",
    "key": {
      "kind": "single_letter",
      "letter": "C"
    }
  },
  "intelligence": {
    "join_status": "UNBOUND",
    "hinge": null,
    "packed_tags": {
      "pack": "middle_6_8",
      "subject": "science",
      "level": "grade 7",
      "topic": "Physical vs chemical change",
      "paper_hint": ""
    },
    "mx": [
      {
        "mx_type": "term_substitution",
        "name": "term_substitution",
        "teacher_note": "Candle wax catches fire as soon as it melts in air."
      },
      {
        "mx_type": "condition_omission",
        "name": "condition_omission",
        "teacher_note": "Paper left in air at room temperature will start burning without being heated."
      },
      {
        "mx_type": "scope_error",
        "name": "scope_error",
        "teacher_note": "The covered candle keeps burning until its wax runs out; oxygen is only needed to light it."
      },
      {
        "mx_type": "surface_feature_capture",
        "name": "surface_feature_capture",
        "teacher_note": "The candle goes out immediately when the opaque cover hides its flame."
      }
    ],
    "enrichment": "Combustion requires a combustible substance, oxygen, and heat that lets the fuel reach its ignition temperature. Providing all three requirements allows burning to start or continue; removing any one requirement prevents or stops combustion. The learner predicts burning by checking all three requirements: fuel, oxygen, and enough heat to reach ignition temperature. A fire burns as long as there is fuel; oxygen and ignition temperature are optional details.",
    "lbs_recipe": {
      "unit": "science/grade_07/ch_05/H004",
      "gate_names": [
        "intermediate_omission",
        "intermediate_omission",
        "intermediate_omission"
      ],
      "hint_skeleton": "",
      "retry_plan": "retry original unaided"
    },
    "modify_seeds": [
      "Rewrite this item so option A remains the trap for a student swapping the sibling term “Carbon can form four single covalent bonds.” for the required “Covalent bonding involves losing and gaining elec…”. Change the numbers, species or wording; rewrite the stem and all four options as one coherent item. Do not print mix-up labels on the learner stem. Recalculate the key.",
      "Rewrite this item so option B remains the trap for a student swapping the sibling term “Chlorine atoms react to gain a noble gas electron…” for the required “Covalent bonding involves losing and gaining elec…”. Change the numbers, species or wording; rewrite the stem and all four options as one coherent item. Do not print mix-up labels on the learner stem. Recalculate the key.",
      "Rewrite this item so option D remains the trap for a student swapping the sibling term “Hydrogen molecules have the formula H₂.” for the required “Covalent bonding involves losing and gaining elec…”. Change the numbers, species or wording; rewrite the stem and all four options as one coherent item. Do not print mix-up labels on the learner stem. Recalculate the key."
    ]
  },
  "spec": {
    "instruction": "Write one new grades 7 Science question. Chapter: Physical and chemical changes. The student must decide: Predict whether combustion will start or continue by checking for fuel, oxygen, and enough heat to reach ignition temperature. Use an Indian school or home setting and Indian names. Keep the source language register. Retarget the source onto this Science decision. Keep the source item type. Recalculate the key. Do not print mix-up labels, hinge codes, node codes, or the word CANDIDATE.",
    "variation_class": "V4",
    "fidelity_mode": "FAITHFUL_TRANSFER",
    "target_item_type": "preserve",
    "format": {
      "n_options": 4
    },
    "figure": {
      "mode": "preserve",
      "tikz_required": false
    }
  },
  "caps": {
    "hard_total_chars": 16000,
    "tightened_from": "40_PACKETS"
  },
  "assembly": {
    "builder": "assembleModifyPacket",
    "trimmed": [],
    "slim_map_ref": "data/maps/science.json"
  }
}
