{
  "schema": "modify_packet.v1",
  "packet_id": "session:0620_m18_qp_22:q40",
  "slot": "T-MOD",
  "created_at": "2026-09-18T20:53:36.930Z",
  "source": {
    "item_ref": "session:0620_m18_qp_22:q40",
    "item_type": "single_mcq",
    "stem": "The structure of a chlorofluorocarbon polymer is shown.\n\nDisplayed polymer structure: –C(CH₃)(H)–C(Cl)(F)–C(CH₃)(H)–C(Cl)(F)–\n\nWhich monomer is used to make this polymer?",
    "options": [
      {
        "id": "A",
        "text": "Displayed alkene: left C has CH₃ above and F below; right C has Cl above and H below."
      },
      {
        "id": "B",
        "text": "Displayed alkene: left C has H above and CH₃ below; right C has Cl above and F below."
      },
      {
        "id": "C",
        "text": "Displayed alkene: left C has CH₃ above and Cl below; right C has F above and H below."
      },
      {
        "id": "D",
        "text": "Displayed alkene: left C has CH₃ above and Cl below; right C has H above and F below."
      }
    ],
    "statements": [],
    "parts": [],
    "equations": [],
    "tables": [],
    "tikz": "",
    "key": {
      "kind": "single_letter",
      "letter": "B"
    }
  },
  "intelligence": {
    "join_status": "UNBOUND",
    "hinge": null,
    "packed_tags": {
      "pack": "middle_6_8",
      "subject": "science",
      "level": "grade 7",
      "topic": "Physical vs chemical change",
      "paper_hint": ""
    },
    "mx": [
      {
        "mx_type": "condition_omission",
        "name": "condition_omission",
        "teacher_note": "Chopping vegetables is reversible."
      },
      {
        "mx_type": "relationship_reversal",
        "name": "relationship_reversal",
        "teacher_note": "Melting ice is not reversible."
      }
    ],
    "enrichment": "A change is reversible when the original object or substance can be brought back in the form it started with. If the starting form can be recovered, the change is classified as reversible; if it cannot be recovered, it is classified as not reversible. The learner classifies a change as reversible only when the original object or substance can be brought back in its starting form. Once something changes, it is permanent unless it simply looks unchanged by itself.",
    "lbs_recipe": {
      "unit": "science/grade_07/ch_05/H006",
      "gate_names": [
        "relationship_reversal",
        "relationship_reversal",
        "relationship_reversal"
      ],
      "hint_skeleton": "",
      "retry_plan": "retry original unaided"
    },
    "modify_seeds": [
      "Rewrite this item so option A remains the trap for a student reversing the directed relation (right C has Cl above and H below. vs right C has Cl above and F below.). Change the numbers, species or wording; rewrite the stem and all four options as one coherent item. Do not print mix-up labels on the learner stem. Recalculate the key.",
      "Rewrite this item so option C remains the trap for a student reversing the directed relation (right C has F above and H below. vs right C has Cl above and F below.). Change the numbers, species or wording; rewrite the stem and all four options as one coherent item. Do not print mix-up labels on the learner stem. Recalculate the key.",
      "Rewrite this item so option D remains the trap for a student reversing the directed relation (right C has H above and F below. vs right C has Cl above and F below.). Change the numbers, species or wording; rewrite the stem and all four options as one coherent item. Do not print mix-up labels on the learner stem. Recalculate the key."
    ]
  },
  "spec": {
    "instruction": "Write one new grades 7 Science question. Chapter: Physical and chemical changes. The student must decide: Decide whether a change is reversible by asking whether the original object or substance can be brought back. Use an Indian school or home setting and Indian names. Keep the source language register. Change the numbers, materials, or everyday situation. Do not copy the source stem. Recalculate the key. Do not print mix-up labels, hinge codes, node codes, or the word CANDIDATE.",
    "variation_class": "V1",
    "fidelity_mode": "FAITHFUL_TRANSFER",
    "target_item_type": "preserve",
    "format": {
      "n_options": 4
    },
    "figure": {
      "mode": "preserve",
      "tikz_required": false
    }
  },
  "caps": {
    "hard_total_chars": 16000,
    "tightened_from": "40_PACKETS"
  },
  "assembly": {
    "builder": "assembleModifyPacket",
    "trimmed": [],
    "slim_map_ref": "data/maps/science.json"
  }
}
