{
  "schema": "modify_packet.v1",
  "packet_id": "session:0625_m15_qp_12:q8",
  "slot": "T-MOD",
  "created_at": "2026-09-18T20:12:39.857Z",
  "source": {
    "item_ref": "session:0625_m15_qp_12:q8",
    "item_type": "single_mcq",
    "stem": "A helicopter takes off from the ground and rises vertically. It then hovers at a constant height above the ground.\nWhich sequence of energy changes takes place during the gain in height?",
    "options": [
      {
        "id": "A",
        "text": "chemical → gravitational potential → kinetic"
      },
      {
        "id": "B",
        "text": "chemical → kinetic → gravitational potential"
      },
      {
        "id": "C",
        "text": "gravitational potential → chemical → kinetic"
      },
      {
        "id": "D",
        "text": "kinetic → chemical → gravitational potential"
      }
    ],
    "statements": [],
    "parts": [],
    "equations": [],
    "tables": [],
    "tikz": "",
    "key": {
      "kind": "single_letter",
      "letter": "B"
    }
  },
  "intelligence": {
    "join_status": "UNBOUND",
    "hinge": null,
    "packed_tags": {
      "pack": "middle_6_8",
      "subject": "science",
      "level": "grade 6",
      "topic": "Temperature and heat transfer",
      "paper_hint": ""
    },
    "mx": [
      {
        "mx_type": "condition_omission",
        "name": "condition_omission",
        "teacher_note": "The same water will feel warm to one hand and cold to the other even after both hands were kept in the same cold water."
      },
      {
        "mx_type": "scope_error",
        "name": "scope_error",
        "teacher_note": "Even after their readings settle, thermometers previously in hot and cold water will give different readings in the same water."
      },
      {
        "mx_type": "surface_feature_capture",
        "name": "surface_feature_capture",
        "teacher_note": "The red water is hotter than the blue water even though both thermometers show the same temperature."
      }
    ],
    "enrichment": "Sense of touch cannot always decide correctly whether a body is hot or cold; temperature is the reliable measure of hotness or coldness. Different prior contact can change what the same water feels like, while a temperature measurement gives the dependable comparison. The learner correctly applies this rule: Sense of touch cannot always decide correctly whether a body is hot or cold; temperature is the reliable measure of hotness or coldness. If water or a forehead feels hot to a hand, it is hot and no thermometer is needed.",
    "lbs_recipe": {
      "unit": "science/grade_06/ch_07/H001",
      "gate_names": [
        "intermediate_omission",
        "intermediate_omission",
        "intermediate_omission"
      ],
      "hint_skeleton": "",
      "retry_plan": "retry original unaided"
    },
    "modify_seeds": [
      "Rewrite this item so option A remains the trap for a student dropping a stated condition so “gravitational potential” looked possible instead of “kinetic”. Change the numbers, species or wording; rewrite the stem and all four options as one coherent item. Do not print mix-up labels on the learner stem. Recalculate the key.",
      "Rewrite this item so option C remains the trap for a student dropping a stated condition so “gravitational potential” looked possible instead of “chemical”. Change the numbers, species or wording; rewrite the stem and all four options as one coherent item. Do not print mix-up labels on the learner stem. Recalculate the key.",
      "Rewrite this item so option D remains the trap for a student dropping a stated condition so “kinetic” looked possible instead of “chemical”. Change the numbers, species or wording; rewrite the stem and all four options as one coherent item. Do not print mix-up labels on the learner stem. Recalculate the key."
    ]
  },
  "spec": {
    "instruction": "Write one new grades 6 Science question. Chapter: Temperature and its measurement. The student must decide: Decide whether a hot-or-cold judgement can rely on touch or must be checked by measuring temperature. Use an Indian school or home setting and Indian names. Keep the source language register. Retarget the source onto this Science decision. Keep the source item type. Recalculate the key. Do not print mix-up labels, hinge codes, node codes, or the word CANDIDATE.",
    "variation_class": "V4",
    "fidelity_mode": "FAITHFUL_TRANSFER",
    "target_item_type": "preserve",
    "format": {
      "n_options": 4
    },
    "figure": {
      "mode": "preserve",
      "tikz_required": false
    }
  },
  "caps": {
    "hard_total_chars": 16000,
    "tightened_from": "40_PACKETS"
  },
  "assembly": {
    "builder": "assembleModifyPacket",
    "trimmed": [],
    "slim_map_ref": "data/maps/science.json"
  }
}
