{
  "schema": "modify_packet.v1",
  "packet_id": "session:0625_m15_qp_12:q5",
  "slot": "T-MOD",
  "created_at": "2026-09-18T20:58:19.091Z",
  "source": {
    "item_ref": "session:0625_m15_qp_12:q5",
    "item_type": "single_mcq",
    "stem": "A person measures the length, width, height and mass of a metal block with rectangular sides.\nWhich of these measurements must be used in order to calculate the density of the metal?",
    "options": [
      {
        "id": "A",
        "text": "mass only"
      },
      {
        "id": "B",
        "text": "height and mass only"
      },
      {
        "id": "C",
        "text": "length, width and height only"
      },
      {
        "id": "D",
        "text": "length, width, height and mass"
      }
    ],
    "statements": [],
    "parts": [],
    "equations": [],
    "tables": [],
    "tikz": "",
    "key": {
      "kind": "single_letter",
      "letter": "D"
    }
  },
  "intelligence": {
    "join_status": "UNBOUND",
    "hinge": null,
    "packed_tags": {
      "pack": "middle_6_8",
      "subject": "science",
      "level": "grade 7",
      "topic": "Describing motion",
      "paper_hint": ""
    },
    "mx": [
      {
        "mx_type": "condition_omission",
        "name": "condition_omission",
        "teacher_note": "mean → right extreme → mean = one oscillation"
      },
      {
        "mx_type": "scope_error",
        "name": "scope_error",
        "teacher_note": "A pendulum cannot complete an oscillation when counting starts at an extreme position."
      },
      {
        "mx_type": "surface_feature_capture",
        "name": "surface_feature_capture",
        "teacher_note": "mean → right extreme = one oscillation"
      }
    ],
    "enrichment": "One oscillation is completed when the bob starts from the mean position, moves to one extreme position, then to the other extreme position, and returns to the mean position. Returning to the starting mean position after passing both extremes completes one repeat of the pendulum's path. The learner correctly applies this rule: One oscillation is completed when the bob starts from the mean position, moves to one extreme position, then to the other extreme position, and returns to the mean position. Any one-way swing or any return to the mean position counts as one complete oscillation.",
    "lbs_recipe": {
      "unit": "science/grade_07/ch_08/H003",
      "gate_names": [
        "intermediate_omission",
        "intermediate_omission",
        "intermediate_omission"
      ],
      "hint_skeleton": "",
      "retry_plan": "retry original unaided"
    },
    "modify_seeds": [
      "Rewrite this item so option A remains the trap for a student swapping the sibling term “mass only” for the required “length, width, height and mass”. Change the numbers, species or wording; rewrite the stem and all four options as one coherent item. Do not print mix-up labels on the learner stem. Recalculate the key.",
      "Rewrite this item so option B remains the trap for a student dropping a stated condition so “height and mass only” looked possible instead of “length, width, height and mass”. Change the numbers, species or wording; rewrite the stem and all four options as one coherent item. Do not print mix-up labels on the learner stem. Recalculate the key.",
      "Rewrite this item so option C remains the trap for a student dropping a stated condition so “length, width and height only” looked possible instead of “length, width, height and mass”. Change the numbers, species or wording; rewrite the stem and all four options as one coherent item. Do not print mix-up labels on the learner stem. Recalculate the key."
    ]
  },
  "spec": {
    "instruction": "Write one new grades 7 Science question. Chapter: Measurement of time. The student must decide: Decide when a simple pendulum has completed one oscillation. Use an Indian school or home setting and Indian names. Keep the source language register. Change the numbers, materials, or everyday situation. Do not copy the source stem. Recalculate the key. Do not print mix-up labels, hinge codes, node codes, or the word CANDIDATE.",
    "variation_class": "V1",
    "fidelity_mode": "FAITHFUL_TRANSFER",
    "target_item_type": "preserve",
    "format": {
      "n_options": 4
    },
    "figure": {
      "mode": "preserve",
      "tikz_required": false
    }
  },
  "caps": {
    "hard_total_chars": 16000,
    "tightened_from": "40_PACKETS"
  },
  "assembly": {
    "builder": "assembleModifyPacket",
    "trimmed": [],
    "slim_map_ref": "data/maps/science.json"
  }
}
