{
  "schema": "modify_packet.v1",
  "packet_id": "session:0620_m16_qp_12:q36",
  "slot": "T-MOD",
  "created_at": "2026-09-18T18:53:42.340Z",
  "source": {
    "item_ref": "session:0620_m16_qp_12:q36",
    "item_type": "single_mcq",
    "stem": "Which bond is not present in the structure of ethanol, CH₃CH₂OH?",
    "options": [
      {
        "id": "A",
        "text": "C–C"
      },
      {
        "id": "B",
        "text": "H–H"
      },
      {
        "id": "C",
        "text": "H–O"
      },
      {
        "id": "D",
        "text": "O–C"
      }
    ],
    "statements": [],
    "parts": [],
    "equations": [],
    "tables": [],
    "tikz": "",
    "key": {
      "kind": "single_letter",
      "letter": "B"
    }
  },
  "intelligence": {
    "join_status": "UNBOUND",
    "hinge": null,
    "packed_tags": {
      "pack": "middle_6_8",
      "subject": "science",
      "level": "grade 6",
      "topic": "Materials and their properties",
      "paper_hint": ""
    },
    "mx": [
      {
        "mx_type": "relationship_reversal",
        "name": "relationship_reversal",
        "teacher_note": "Sugar: insoluble in water. Sand: soluble in water."
      },
      {
        "mx_type": "scope_error",
        "name": "scope_error",
        "teacher_note": "Neither soluble nor insoluble—solubility applies only to solids."
      }
    ],
    "enrichment": "Some materials completely disappear when mixed in water; these materials dissolve and are soluble in water. Other materials do not mix with water and are insoluble. Some liquids completely mix with water, while others form a separate layer when left undisturbed. observed mixing behavior in water -> soluble, insoluble, or separate-layer outcome The learner correctly applies this rule: Some materials completely disappear when mixed in water; these materials dissolve and are soluble in water. Other materials do not mix with water and are insoluble. Some liquids completely mix with water, while others form a separate layer when left undisturbed. If stirring changes how water looks, the added material has dissolved.",
    "lbs_recipe": {
      "unit": "science/grade_06/ch_06/H007",
      "gate_names": [
        "condition_omission",
        "condition_omission",
        "condition_omission"
      ],
      "hint_skeleton": "",
      "retry_plan": "retry original unaided"
    },
    "modify_seeds": [
      "Rewrite this item so option A remains the trap for a student dropping a stated condition so “C–C” looked possible instead of “H–H”. Change the numbers, species or wording; rewrite the stem and all four options as one coherent item. Do not print mix-up labels on the learner stem. Recalculate the key.",
      "Rewrite this item so option C remains the trap for a student dropping a stated condition so “H–O” looked possible instead of “H–H”. Change the numbers, species or wording; rewrite the stem and all four options as one coherent item. Do not print mix-up labels on the learner stem. Recalculate the key.",
      "Rewrite this item so option D remains the trap for a student dropping a stated condition so “O–C” looked possible instead of “H–H”. Change the numbers, species or wording; rewrite the stem and all four options as one coherent item. Do not print mix-up labels on the learner stem. Recalculate the key."
    ]
  },
  "spec": {
    "instruction": "Write one new grades 6 Science question. Chapter: Materials around us. The student must decide: When a material is mixed with water, decide whether it is soluble or insoluble from whether it dissolves completely. Use an Indian school or home setting and Indian names. Keep the source language register. Retarget the source onto this Science decision. Keep the source item type. Recalculate the key. Do not print mix-up labels, hinge codes, node codes, or the word CANDIDATE.",
    "variation_class": "V4",
    "fidelity_mode": "FAITHFUL_TRANSFER",
    "target_item_type": "preserve",
    "format": {
      "n_options": 4
    },
    "figure": {
      "mode": "preserve",
      "tikz_required": false
    }
  },
  "caps": {
    "hard_total_chars": 16000,
    "tightened_from": "40_PACKETS"
  },
  "assembly": {
    "builder": "assembleModifyPacket",
    "trimmed": [],
    "slim_map_ref": "data/maps/science.json"
  }
}
