{
  "schema": "modify_packet.v1",
  "packet_id": "session:0610_m16_qp_12:q4",
  "slot": "T-MOD",
  "created_at": "2026-09-18T20:02:33.462Z",
  "source": {
    "item_ref": "session:0610_m16_qp_12:q4",
    "item_type": "single_mcq",
    "stem": "A palisade cell and a nerve cell are observed under a light microscope.\nOnly the palisade cell has a",
    "options": [
      {
        "id": "A",
        "text": "cell membrane."
      },
      {
        "id": "B",
        "text": "cytoplasm."
      },
      {
        "id": "C",
        "text": "nucleus."
      },
      {
        "id": "D",
        "text": "vacuole."
      }
    ],
    "statements": [],
    "parts": [],
    "equations": [],
    "tables": [],
    "tikz": "",
    "key": {
      "kind": "single_letter",
      "letter": "D"
    }
  },
  "intelligence": {
    "join_status": "UNBOUND",
    "hinge": null,
    "packed_tags": {
      "pack": "middle_6_8",
      "subject": "science",
      "level": "grade 8",
      "topic": "Habitats, microbes and ecosystems",
      "paper_hint": ""
    },
    "mx": [
      {
        "mx_type": "term_substitution",
        "name": "term_substitution",
        "teacher_note": "Microalgae supply nitrogen rather than oxygen when they make food using sunlight."
      },
      {
        "mx_type": "condition_omission",
        "name": "condition_omission",
        "teacher_note": "Microalgae can keep making their own food by this process even in permanent darkness."
      },
      {
        "mx_type": "relationship_reversal",
        "name": "relationship_reversal",
        "teacher_note": "Conserving microalgae increases pollution because abundant microalgae cause it."
      },
      {
        "mx_type": "scope_error",
        "name": "scope_error",
        "teacher_note": "Every microalga has the same nutritional value as Spirulina."
      }
    ],
    "enrichment": "Microalgae are microscopic plant-like organisms that live in water, soil, air, and even on trees. They make their own food using sunlight, help maintain oxygen balance, and conserving them supports the environment, food security, and livelihood development. Microalgae use sunlight and remain diverse and abundant -> oxygen balance and useful food-related resources are supported. The learner correctly applies this rule: Microalgae are microscopic plant-like organisms that live in water, soil, air, and even on trees. They make their own food using sunlight, help maintain oxygen balance, and conserving them supports the environment, food security, and livelihood development. Microalgae are just pond scum, so losing them would not affect oxygen, food, or people.",
    "lbs_recipe": {
      "unit": "science/grade_08/ch_02/H014",
      "gate_names": [
        "intermediate_omission",
        "intermediate_omission",
        "intermediate_omission"
      ],
      "hint_skeleton": "",
      "retry_plan": "retry original unaided"
    },
    "modify_seeds": [
      "Rewrite this item so option A remains the trap for a student matching a salient stem word and choosing “cell membrane.” instead of “vacuole.”. Change the numbers, species or wording; rewrite the stem and all four options as one coherent item. Do not print mix-up labels on the learner stem. Recalculate the key.",
      "Rewrite this item so option B remains the trap for a student swapping the sibling term “cytoplasm.” for the required “vacuole.”. Change the numbers, species or wording; rewrite the stem and all four options as one coherent item. Do not print mix-up labels on the learner stem. Recalculate the key.",
      "Rewrite this item so option C remains the trap for a student swapping the sibling term “nucleus.” for the required “vacuole.”. Change the numbers, species or wording; rewrite the stem and all four options as one coherent item. Do not print mix-up labels on the learner stem. Recalculate the key."
    ]
  },
  "spec": {
    "instruction": "Write one new grades 8 Science question. Chapter: Microorganisms: friend and foe. The student must decide: Decide why conserving microalgae matters for the environment, oxygen balance, food security, and livelihoods. Use an Indian school or home setting and Indian names. Keep the source language register. Retarget the source onto this Science decision. Keep the source item type. Recalculate the key. Do not print mix-up labels, hinge codes, node codes, or the word CANDIDATE.",
    "variation_class": "V4",
    "fidelity_mode": "FAITHFUL_TRANSFER",
    "target_item_type": "preserve",
    "format": {
      "n_options": 4
    },
    "figure": {
      "mode": "preserve",
      "tikz_required": false
    }
  },
  "caps": {
    "hard_total_chars": 16000,
    "tightened_from": "40_PACKETS"
  },
  "assembly": {
    "builder": "assembleModifyPacket",
    "trimmed": [],
    "slim_map_ref": "data/maps/science.json"
  }
}
