{
  "schema": "modify_packet.v1",
  "packet_id": "session:0625_m15_qp_12:q5",
  "slot": "T-MOD",
  "created_at": "2026-09-18T21:16:59.855Z",
  "source": {
    "item_ref": "session:0625_m15_qp_12:q5",
    "item_type": "single_mcq",
    "stem": "A person measures the length, width, height and mass of a metal block with rectangular sides.\nWhich of these measurements must be used in order to calculate the density of the metal?",
    "options": [
      {
        "id": "A",
        "text": "mass only"
      },
      {
        "id": "B",
        "text": "height and mass only"
      },
      {
        "id": "C",
        "text": "length, width and height only"
      },
      {
        "id": "D",
        "text": "length, width, height and mass"
      }
    ],
    "statements": [],
    "parts": [],
    "equations": [],
    "tables": [],
    "tikz": "",
    "key": {
      "kind": "single_letter",
      "letter": "D"
    }
  },
  "intelligence": {
    "join_status": "UNBOUND",
    "hinge": null,
    "packed_tags": {
      "pack": "middle_6_8",
      "subject": "science",
      "level": "grade 8",
      "topic": "Force and pressure",
      "paper_hint": ""
    },
    "mx": [
      {
        "mx_type": "term_substitution",
        "name": "term_substitution",
        "teacher_note": "An object can remain at rest while unbalanced forces act on it."
      },
      {
        "mx_type": "relationship_reversal",
        "name": "relationship_reversal",
        "teacher_note": "Stopping an object automatically makes all the forces on it balance."
      },
      {
        "mx_type": "scope_error",
        "name": "scope_error",
        "teacher_note": "A moving object cannot have balanced forces."
      },
      {
        "mx_type": "surface_feature_capture",
        "name": "surface_feature_capture",
        "teacher_note": "No force acts on the book because it is not moving."
      }
    ],
    "enrichment": "An object being at rest does not mean that no force acts on it; the forces acting on the object may be balancing one another. forces balance one another -> object can remain at rest The learner correctly applies this rule: An object being at rest does not mean that no force acts on it; the forces acting on the object may be balancing one another. If an object is not moving, no force can be acting on it.",
    "lbs_recipe": {
      "unit": "science/grade_08/ch_05/H003",
      "gate_names": [
        "intermediate_omission",
        "intermediate_omission",
        "intermediate_omission"
      ],
      "hint_skeleton": "",
      "retry_plan": "retry original unaided"
    },
    "modify_seeds": [
      "Rewrite this item so option A remains the trap for a student swapping the sibling term “mass only” for the required “length, width, height and mass”. Change the numbers, species or wording; rewrite the stem and all four options as one coherent item. Do not print mix-up labels on the learner stem. Recalculate the key.",
      "Rewrite this item so option B remains the trap for a student dropping a stated condition so “height and mass only” looked possible instead of “length, width, height and mass”. Change the numbers, species or wording; rewrite the stem and all four options as one coherent item. Do not print mix-up labels on the learner stem. Recalculate the key.",
      "Rewrite this item so option C remains the trap for a student dropping a stated condition so “length, width and height only” looked possible instead of “length, width, height and mass”. Change the numbers, species or wording; rewrite the stem and all four options as one coherent item. Do not print mix-up labels on the learner stem. Recalculate the key."
    ]
  },
  "spec": {
    "instruction": "Write one new grades 8 Science question. Chapter: Force. The student must decide: Decide whether an object at rest must have no force acting on it. Use an Indian school or home setting and Indian names. Keep the source language register. Change the numbers, materials, or everyday situation. Do not copy the source stem. Recalculate the key. Do not print mix-up labels, hinge codes, node codes, or the word CANDIDATE.",
    "variation_class": "V1",
    "fidelity_mode": "FAITHFUL_TRANSFER",
    "target_item_type": "preserve",
    "format": {
      "n_options": 4
    },
    "figure": {
      "mode": "preserve",
      "tikz_required": false
    }
  },
  "caps": {
    "hard_total_chars": 16000,
    "tightened_from": "40_PACKETS"
  },
  "assembly": {
    "builder": "assembleModifyPacket",
    "trimmed": [],
    "slim_map_ref": "data/maps/science.json"
  }
}
