{
  "schema": "modify_packet.v1",
  "packet_id": "session:0620_m15_qp_12:q36",
  "slot": "T-MOD",
  "created_at": "2026-09-18T19:48:54.099Z",
  "source": {
    "item_ref": "session:0620_m15_qp_12:q36",
    "item_type": "single_mcq",
    "stem": "The structures of four molecules are shown.\n\nWhich molecules belong to the same homologous series?",
    "options": [
      {
        "id": "A",
        "text": "1 and 2"
      },
      {
        "id": "B",
        "text": "1 and 3"
      },
      {
        "id": "C",
        "text": "2 and 4"
      },
      {
        "id": "D",
        "text": "3 and 4"
      }
    ],
    "statements": [],
    "parts": [],
    "equations": [],
    "tables": [],
    "tikz": "",
    "key": {
      "kind": "single_letter",
      "letter": "A"
    }
  },
  "intelligence": {
    "join_status": "UNBOUND",
    "hinge": null,
    "packed_tags": {
      "pack": "middle_6_8",
      "subject": "science",
      "level": "grade 8",
      "topic": "Mixtures, solutions, pure substances and separation",
      "paper_hint": ""
    },
    "mx": [
      {
        "mx_type": "term_substitution",
        "name": "term_substitution",
        "teacher_note": "A mixture is a compound because two substances are present together."
      },
      {
        "mx_type": "condition_omission",
        "name": "condition_omission",
        "teacher_note": "The decision still holds even if we ignore this condition: The stated observation is for baking soda in water in the chapter's activity."
      },
      {
        "mx_type": "scope_error",
        "name": "scope_error",
        "teacher_note": "This rule applies even when The stated observation is for baking soda in water in the chapter's activity is not true."
      },
      {
        "mx_type": "surface_feature_capture",
        "name": "surface_feature_capture",
        "teacher_note": "It is a mixture because you can see two colours."
      }
    ],
    "enrichment": "In the baking soda and water activity, heating the mixture from about 20 C to 50 C while stirring makes the undissolved baking soda dissolve and allows more baking soda to dissolve at the higher temperature. Raising the temperature in this activity increases the amount of baking soda that dissolves in the water. The learner correctly applies this rule: In the baking soda and water activity, heating the mixture from about 20 C to 50 C while stirring makes the undissolved baking soda dissolve and allows more baking soda to dissolve at the higher temperature. Heating only warms the water and does not change how much baking soda can dissolve.",
    "lbs_recipe": {
      "unit": "science/grade_08/ch_09/H005",
      "gate_names": [
        "scope_error",
        "scope_error",
        "scope_error"
      ],
      "hint_skeleton": "",
      "retry_plan": "retry original unaided"
    },
    "modify_seeds": [
      "Rewrite this item so option B remains the trap for a student including statement 3 which the keyed set rejects. Change the numbers, species or wording; rewrite the stem and all four options as one coherent item. Do not print mix-up labels on the learner stem. Recalculate the key.",
      "Rewrite this item so option C remains the trap for a student including statement 4 which the keyed set rejects. Change the numbers, species or wording; rewrite the stem and all four options as one coherent item. Do not print mix-up labels on the learner stem. Recalculate the key.",
      "Rewrite this item so option D remains the trap for a student including statement 3 which the keyed set rejects. Change the numbers, species or wording; rewrite the stem and all four options as one coherent item. Do not print mix-up labels on the learner stem. Recalculate the key."
    ]
  },
  "spec": {
    "instruction": "Write one new grades 8 Science question. Chapter: Solutions and density. The student must decide: Predict what heating does in the baking soda and water solubility activity. Use an Indian school or home setting and Indian names. Keep the source language register. Retarget the source onto this Science decision. Keep the source item type. Recalculate the key. Do not print mix-up labels, hinge codes, node codes, or the word CANDIDATE.",
    "variation_class": "V4",
    "fidelity_mode": "FAITHFUL_TRANSFER",
    "target_item_type": "preserve",
    "format": {
      "n_options": 4
    },
    "figure": {
      "mode": "preserve",
      "tikz_required": false
    }
  },
  "caps": {
    "hard_total_chars": 16000,
    "tightened_from": "40_PACKETS"
  },
  "assembly": {
    "builder": "assembleModifyPacket",
    "trimmed": [],
    "slim_map_ref": "data/maps/science.json"
  }
}
