{
  "schema": "modify_packet.v1",
  "packet_id": "session:0625_m15_qp_12:q8",
  "slot": "T-MOD",
  "created_at": "2026-09-18T21:15:36.908Z",
  "source": {
    "item_ref": "session:0625_m15_qp_12:q8",
    "item_type": "single_mcq",
    "stem": "A helicopter takes off from the ground and rises vertically. It then hovers at a constant height above the ground.\nWhich sequence of energy changes takes place during the gain in height?",
    "options": [
      {
        "id": "A",
        "text": "chemical → gravitational potential → kinetic"
      },
      {
        "id": "B",
        "text": "chemical → kinetic → gravitational potential"
      },
      {
        "id": "C",
        "text": "gravitational potential → chemical → kinetic"
      },
      {
        "id": "D",
        "text": "kinetic → chemical → gravitational potential"
      }
    ],
    "statements": [],
    "parts": [],
    "equations": [],
    "tables": [],
    "tikz": "",
    "key": {
      "kind": "single_letter",
      "letter": "B"
    }
  },
  "intelligence": {
    "join_status": "UNBOUND",
    "hinge": null,
    "packed_tags": {
      "pack": "middle_6_8",
      "subject": "science",
      "level": "grade 8",
      "topic": "Cells, current and magnetic/heating effects",
      "paper_hint": ""
    },
    "mx": [
      {
        "mx_type": "condition_omission",
        "name": "condition_omission",
        "teacher_note": "The clips keep clinging after the current stops."
      },
      {
        "mx_type": "relationship_reversal",
        "name": "relationship_reversal",
        "teacher_note": "Putting the iron nail inside makes the electromagnet weaker."
      },
      {
        "mx_type": "scope_error",
        "name": "scope_error",
        "teacher_note": "Without the nail, the powered coil cannot deflect the compass."
      },
      {
        "mx_type": "mechanism_conflation",
        "name": "mechanism_conflation",
        "teacher_note": "The cold electromagnet cannot pick up clips until its nail heats up."
      }
    ],
    "enrichment": "A current-carrying coil behaves like a magnet, and placing an iron nail in the coil makes the electromagnet stronger. current flows through the coil -> the coil behaves like a magnet and deflects a compass; iron nail inside the coil -> stronger electromagnet -> iron or steel clips cling more strongly; current stops -> clips no longer cling The learner correctly applies this rule: A current-carrying coil behaves like a magnet, and placing an iron nail in the coil makes the electromagnet stronger. Wrapping wire around a nail makes the nail a permanent magnet whether or not current is flowing.",
    "lbs_recipe": {
      "unit": "science/grade_08/ch_04/H002",
      "gate_names": [
        "intermediate_omission",
        "intermediate_omission",
        "intermediate_omission"
      ],
      "hint_skeleton": "",
      "retry_plan": "retry original unaided"
    },
    "modify_seeds": [
      "Rewrite this item so option A remains the trap for a student dropping a stated condition so “gravitational potential” looked possible instead of “kinetic”. Change the numbers, species or wording; rewrite the stem and all four options as one coherent item. Do not print mix-up labels on the learner stem. Recalculate the key.",
      "Rewrite this item so option C remains the trap for a student dropping a stated condition so “gravitational potential” looked possible instead of “chemical”. Change the numbers, species or wording; rewrite the stem and all four options as one coherent item. Do not print mix-up labels on the learner stem. Recalculate the key.",
      "Rewrite this item so option D remains the trap for a student dropping a stated condition so “kinetic” looked possible instead of “chemical”. Change the numbers, species or wording; rewrite the stem and all four options as one coherent item. Do not print mix-up labels on the learner stem. Recalculate the key."
    ]
  },
  "spec": {
    "instruction": "Write one new grades 8 Science question. Chapter: Electricity: magnetic and heating effects. The student must decide: Decide whether a current-carrying coil is acting as a temporary magnet and whether an iron nail core makes it stronger. Use an Indian school or home setting and Indian names. Keep the source language register. Change the numbers, materials, or everyday situation. Do not copy the source stem. Recalculate the key. Do not print mix-up labels, hinge codes, node codes, or the word CANDIDATE.",
    "variation_class": "V1",
    "fidelity_mode": "FAITHFUL_TRANSFER",
    "target_item_type": "preserve",
    "format": {
      "n_options": 4
    },
    "figure": {
      "mode": "preserve",
      "tikz_required": false
    }
  },
  "caps": {
    "hard_total_chars": 16000,
    "tightened_from": "40_PACKETS"
  },
  "assembly": {
    "builder": "assembleModifyPacket",
    "trimmed": [],
    "slim_map_ref": "data/maps/science.json"
  }
}
